{
  "id": "cephalic_vein_right",
  "name": "Right Cephalic Vein",
  "system": "cardiovascular",
  "region": "upper_limb",
  "parentId": "upper_limb",
  "modelFile": "models/cephalic_vein_right.glb",
  "description": "Superficial vein of the lateral upper limb. Ascends the lateral forearm and arm and runs in the deltopectoral groove to drain into the axillary vein.",
  "classification": "Vein",
  "schematic": true,
  "clinical": [
    "A common site for venepuncture and intravenous access; also used as a conduit in vascular surgery."
  ],
  "references": [
    { "label": "Wikipedia: Cephalic vein", "url": "https://en.wikipedia.org/wiki/Cephalic_vein" }
  ]
}
